


Run Date,Action,Symbol,Security Description,Security Type,Quantity,Price ($),Commission ($),Fees ($),Accrued Interest ($),Amount ($),Settlement Date
 12/31/2014, REINVESTMENT, FDRXX, FIDELITY CASH RESERVES,Cash,0.21,1,,,,-0.21,
 12/31/2014, DIVIDEND RECEIVED, FDRXX, FIDELITY CASH RESERVES,Cash,,,,,,0.21,
 11/28/2014, REINVESTMENT, FDRXX, FIDELITY CASH RESERVES,Cash,0.15,1,,,,-0.15,
 11/28/2014, DIVIDEND RECEIVED, FDRXX, FIDELITY CASH RESERVES,Cash,,,,,,0.15,
 11/13/2014, DIVIDEND RECEIVED, AAPL, APPLE INC,Cash,,,,,,230.3,
 10/31/2014, REINVESTMENT, FDRXX, FIDELITY CASH RESERVES,Cash,0.16,1,,,,-0.16,
 10/31/2014, DIVIDEND RECEIVED, FDRXX, FIDELITY CASH RESERVES,Cash,,,,,,0.16,
 10/31/2014, DIVIDEND RECEIVED, NLY, ANNALY CAPITAL MANAGEMENT INC COM,Cash,,,,,,150,
 10/07/2014, YOU BOUGHT, INXX, EGA EMERGING GLOBAL SHS TR EGSHARES IND,Cash,500,12.75, 7.95,,,-6382.95, 10/10/2014





"The data and information in this spreadsheet is provided to you solely for your use and is not for distribution. The spreadsheet is provided for"
"informational purposes only, and is not intended to provide advice, nor should it be construed as an offer to sell, a solicitation of an offer to buy or a"
"recommendation for any security by Fidelity or any third party. Data and information shown is based on information known to Fidelity as of the date it was"
"exported and is subject to change. It should not be used in place of your account statements or trade confirmations and is not intended for tax reporting"
"purposes. For more information on the data included in this spreadsheet, including any limitations thereof, go to Fidelity.com."

"Brokerage services are provided by Fidelity Brokerage Services LLC, 900 Salem Street, Smithfield, RI 02917. Custody and other services provided by National"
"Financial Services LLC. Both are Fidelity Investment companies and members SIPC, NYSE."

"Date downloaded" 01/01/2015, 10:24 AM